{
  "diagnosis_sequence_id": "DiagSeq_001",
  "machine_id": "TMV-720",
  "holder_id": "sth01",
  "diagnoses": [
    {
      "diagnosis_id": "Diagnosis_w10231_stable",
      "window_id": "w10231",
      "machine_id": "TMV-720",
      "holder_id": "sth01",
      "state_label": "stable",
      "process_state_uri": "sth:StableState_01",
      "chatter_score": 0.12,
      "confidence": 0.94,
      "model_version": "lstm-chatter-v2.1",
      "timestamp": "2026-04-13T10:00:00.400Z",
      "previous_diagnosis_id": "",
      "ontology_mapping": {
        "class_uri": "sth:Diagnosis",
        "individual_uri": "sth:Diagnosis_w10233_chatter",
        "json_field_uri": "sth:Field_diagnosis_label",
        "mqtt_topic_uri": "sth:Topic_Diagnosis",
        "opcua_node_uri": "sth:OPCUA_DiagnosisState"
      },
      "next_diagnosis_id": "Diagnosis_w10232_transition"
    },
    {
      "diagnosis_id": "Diagnosis_w10232_transition",
      "window_id": "w10232",
      "machine_id": "TMV-720",
      "holder_id": "sth01",
      "state_label": "transition",
      "process_state_uri": "sth:TransitionState_01",
      "chatter_score": 0.28,
      "confidence": 0.94,
      "model_version": "lstm-chatter-v2.1",
      "timestamp": "2026-04-13T10:00:00.400Z",
      "previous_diagnosis_id": "Diagnosis_w10231_stable",
      "ontology_mapping": {
        "class_uri": "sth:Diagnosis",
        "individual_uri": "sth:Diagnosis_w10233_chatter",
        "json_field_uri": "sth:Field_diagnosis_label",
        "mqtt_topic_uri": "sth:Topic_Diagnosis",
        "opcua_node_uri": "sth:OPCUA_DiagnosisState"
      },
      "next_diagnosis_id": "Diagnosis_w10233_chatter"
    },
    {
      "diagnosis_id": "Diagnosis_w10233_chatter",
      "window_id": "w10233",
      "machine_id": "TMV-720",
      "holder_id": "sth01",
      "state_label": "chatter",
      "process_state_uri": "sth:ChatterState_01",
      "chatter_score": 0.93,
      "confidence": 0.94,
      "model_version": "lstm-chatter-v2.1",
      "timestamp": "2026-04-13T10:00:00.400Z",
      "previous_diagnosis_id": "Diagnosis_w10232_transition",
      "ontology_mapping": {
        "class_uri": "sth:Diagnosis",
        "individual_uri": "sth:Diagnosis_w10233_chatter",
        "json_field_uri": "sth:Field_diagnosis_label",
        "mqtt_topic_uri": "sth:Topic_Diagnosis",
        "opcua_node_uri": "sth:OPCUA_DiagnosisState"
      }
    }
  ],
  "ontology_mapping": {
    "class_uri": "sth:DiagnosisSequence",
    "individual_uri": "sth:DiagSeq_001",
    "json_field_uri": "sth:Field_diagnosis_sequence",
    "mqtt_topic_uri": "sth:Topic_DiagnosisSequence",
    "opcua_node_uri": "sth:OPCUA_DiagnosisSequence"
  }
}
